,Time,Source,Content
0,null,null,"סקירת עיתונות / מבזקים וחדשות
מחפשים חופשה בזול? לחצו כאןלוח שנה עברי"
1,18:53 20/06,ערוץ 7,"ח״כ אופיר סופר: שהחיינו וקיימנו, הממשלה האנטי ציונית של בנט-עבאס הגיעה לסופה"
2,18:53 20/06,וואלה,לפיד ובנט החליטו לפזר את הכנסת; לפיד ימונה לראש ממשלת מעבר
3,18:52 20/06,ערוץ 7,"שחקן המריבה בחר בהפועל ת""א"
4,18:50 20/06,ישראל היום,בנט ולפיד סיכמו: הכנסת תפוזר
5,18:49 20/06,רוטר.נט,"לפיד ובנט בהודעה משותפת: מוצו הניסיונות לייצב את הקואליציה, תובא הצעת חוק לפיזור הכנסת ולאחריה יאיר לפיד יהפוך לראש ממשלת מעבר"
6,18:47 20/06,mako,"הכנסת מתפזרת: בנט ולפיד סיכמו על קידום החוק לפיזור הכנסת, לפיד ייכנס ללשכת רה""מ"
7,18:46 20/06,מעריב,"הכנסת מתפזרת: בנט ולפיד סיכמו על קידום החוק לפיזור הכנסת, לפיד ייכנס ללשכת רה""מ"
8,18:45 20/06,וואלה,"בנט ולפיד סיכמו על קידום החוק לפיזור הכנסת, לפיד ייכנס ללשכת רה""מ"
9,18:45 20/06,ice,אימת הפיצוציות בדרך לכלא: כך עבדה שיטת הפעולה שלו
10,18:45 20/06,ice,זו החבילה החדשה והיקרה שהשיקה דיסני
11,18:45 20/06,ice,הנסיך ויליאם מכר עיתונים - וכעת מסביר למה
12,null,null,רכב הפנאי MG EHS SUV מסמן V על מבחן הנהיגה של אוטו (MG EHS)
13,18:43 20/06,ערוץ 7,"הכנסת מתפזרת, בנט ולפיד ימסרו הודעה ב-20:00 בערב. לפיד יתמנה לראש הממשלה"
14,18:42 20/06,ערוץ 7,ראשי הקואליציה נכנסו ללשכת בנט בכנסת
15,18:37 20/06,mako,אבעבועות הקוף: מקרה הדבקה ראשון בתוך ישראל
16,18:34 20/06,ערוץ 7,חדש בוואטסאפ: ניתן להשתיק אדם ספציפי בקבוצה
17,18:30 20/06,ערוץ 7,"ניקול ראידמן מתקרבת: ""מעכשיו אוכלת רק כשר"""
18,18:30 20/06,ערוץ 7,"ועדת גילאור אישרה את מינוי מאיר שפיגר למנכ""ל חברת החשמל"
19,18:30 20/06,ice,סמסונג משיקה את תכנית הריאליטי הראשונה מסוגה בישראל
20,18:30 20/06,ice,ציון ברוך מצטרף ליטבתה: זה הסכום שהושקע בו
21,18:29 20/06,ישראל היום,בית הדין של האיגוד קבע: קבוצות יוכלו לשתף מתאזרח אחד במשחק
22,18:29 20/06,ישראל היום,תיעוד מקומם ממקסיקו: בני זוג השליכו את בתם בת ה-3 לתוך מכל מים - ונעצרו
23,18:23 20/06,ישראל היום,במהלך חקירה בתיק אחר: נעצר חשוד באונס שבוצע לפני 5 שנים
24,18:23 20/06,ישראל היום,תיעוד מקומם ממקסיקו: בני זוג השליכו את בתם בת ה-3 לתוך מיכל מים - ונעצרו
25,18:20 20/06,מעריב,"רוכב אופניים בן 61 נפצע בזמן רכיבה בצומת פוריידיס, מצבו בינוני"
26,18:20 20/06,ישראל היום,לא נחים לרגע: בני ריינה החתימה בלם פורטוגלי
27,18:20 20/06,ישראל היום,תיעוד קורע לב ממקסיקו: בני זוג השליכו את בתם בת ה-3 לתוך מיכל מים - ונעצרו
28,18:18 20/06,ערוץ 7,"גבר בן 61 נפל במהלך רכיבה על אופניים בצומת פוריידיס, מצבו בינוני"
29,18:16 20/06,Ynet,חרם על המובלעת הרוסית בליטא; פוטין מעלה הילוך לפני הכרעת האיחוד האירופי
30,18:15 20/06,ice,"ערן זהבי חוזר למכבי ת""א? זה הרמז העבה ששלח לאוהדים"
31,18:13 20/06,מעריב,"גבר כבן 42 נפצע באירוע אלימות בשפרעם, מצבו בינוני"
32,18:12 20/06,ישראל היום,כבר לא שם: דודי סלע הובס במוקדמות ווימבלדון
33,null,null,הכרחי לחולי לב: המכשיר החדשני שהופך כל טלפון חכם למכשיר א.ק.ג נייד (Round Table)
34,18:12 20/06,ערוץ 7,שוטרי מחוז ירושלים חילצו פעוט בן מספר חודשים שנשכח ברכב לבדו
35,18:12 20/06,וואלה,ליטא: הסחורה שעצרנו לקלינינגרד - סחורה שהאיחוד האירופי הגביל
36,18:11 20/06,ערוץ 7,פצוע בינוני באירוע אלימות בשפרעם
37,18:09 20/06,mako,חשד: משגיח בבחינות תיאוריה ביצע מעשים מגונים בנערות
38,18:07 20/06,ערוץ 7,הרב עמיחי אליהו: אני הייתי מעביר לכהנא את הכוס וגם לוחץ לו יד
39,18:00 20/06,ice,אלפי רכבים חדשים עולים לכביש: זה הדגם שיקבלו בממשלה
40,18:00 20/06,ערוץ 7,"בחודש הבא: הכנסת ספר תורה לזכר דוד בר קפרא הי""ד"
41,17:58 20/06,מעריב,המפלגה השמרנית בצרפת פסלה הקמת קואליציה עם מפלגתו של הנשיא מקרון
42,17:54 20/06,וואלה,"ראש המל""ל שב מביקור מדיני בירדן"
43,17:51 20/06,Ynet,"אישום: ביצע מעשה מגונה בילד בדרך למגרש כדורגל, בן ה-11 בעט בו וברח"
44,17:47 20/06,ישראל היום,ישראלית נעצרה ל-28 יום בבלארוס: התקינה ברכבה סרט בצבעי דגל אוקראינה
45,17:47 20/06,ישראל היום,משבדיה באהבה: דניאל סונדגרן חתם רשמית במכבי חיפה
46,17:46 20/06,ערוץ 7,"קארה, שקד ואורבך הודיעו לבנט: אם חוק הנאשם יקודם, נפיל את הממשלה"
47,17:46 20/06,ערוץ 7,תיעוד: שני תושבי מזרח ירושלים ניסו לשדוד בשמים מסניף סופר פארם
48,17:45 20/06,ice,הקלות מס למאות גופים: מי יוכלו להנות מההטבה החדשה?
49,17:45 20/06,ice,"כתב ""ידיעות"" לענייני פלסטינים מצטרף לתאגיד השידור"
50,17:45 20/06,ice,"נטלי דדון נשברת ומתפרקת בבכי: ""יש בורא עולם"""
51,17:40 20/06,ערוץ 7,גלריית תמונות: 50 שנות ביבלה
52,17:36 20/06,ערוץ 7,"מסתנן מסודן תקף קשישה בת 74 בתחנה המרכזית בת""א"
53,17:33 20/06,ישראל היום,עמדות טעינה – גם לאוטובוסים
54,17:30 20/06,ישראל היום,"חוזר הביתה: תומר גינת חתם בהפועל ת""א ל-5 עונות"
55,17:30 20/06,ice,בירה ב-500 דולר: זו עיירת הנופש שעוקצת תיירים ישראלים
56,17:29 20/06,ערוץ 7,משגיח בבחינות תיאוריה מירושלים נעצר בחשד שביצע מעשים מגונים בנערות
57,17:25 20/06,mako,"בשליחות ראש הממשלה נפתלי בנט, ביקר היום ראש המל""ל איל חולתא בירדן"
58,17:25 20/06,מעריב,משרד הבריאות: שלושה גברים נוספים אובחנו כחולים באבעבועות הקוף
59,17:23 20/06,mako,"התקדמות בחקירת רצח ספיר נחום: ""ההתפתחות - בימים האחרונים"""
60,17:23 20/06,וואלה,שלושה גברים נוספים אובחנו כחולים באבעבועות הקוף בישראל
61,17:22 20/06,ערוץ 7,גורם מדיני בכיר: נהרוס את בתי המחבלים אבל לא לפני ביקור ביידן
62,17:18 20/06,ערוץ 7,"מאי גולן: ""ראש ממשלת הרזרבה יאיר לפיד מעז להאשים את הליכוד בשוחד פוליטי. מי יקנה לו מראה?"""
63,17:17 20/06,ישראל היום,בוקר עצוב בהרצליה: דולפינן נמצא מת בחוף הים
64,17:16 20/06,Ynet,מנהרה מתחת לכביש 4 ופאנלים סולאריים על הגגות: התוכנית לגוש דן ב-2040
65,17:15 20/06,מעריב,ראש המטה לביטחון לאומי ביקר היום בירדן
66,17:14 20/06,ישראל היום,"ראש המל""ל ביקר בירדן ודן בצעדים שישראל תנקוט לטובת הפלשתינים"
67,17:14 20/06,ערוץ 7,היועץ לביטחון לאומי איל חולתא ביקר בירדן
68,17:13 20/06,ערוץ 7,העצמאים לוחצים: לאשר את חוק האומיקרון
69,17:12 20/06,ישראל היום,לראשונה מאז גל העלייה מברית המועצות: שיא במספר התחלות הבנייה
70,17:12 20/06,ישראל היום,"נכנס להיכל התהילה האדום: על הבחירה של תומר גינת בהפועל ת""א"
71,17:07 20/06,מעריב,"רה""מ בנט: ""המאמצים המשותפים של שירותי הביטחון הישראלים והטורקים הביאו לסיכול של פיגועים איראנים"""
72,17:04 20/06,Ynet,"בנט הודה לארדואן: ""טורקיה וישראל סיכלו יחד כמה פיגועים, המלאכה עוד לא תמה"""
73,17:03 20/06,ישראל היום,ישראל וטורקיה סיכלו בפעולה משותפת חוליות טרור שניסו לפגוע בישראלים
74,17:03 20/06,ערוץ 7,"רה""מ בנט: ""סיכלנו מספר פיגועים ועצרנו מחבלים על אדמת טורקיה, מודה לארדואן"""
75,17:03 20/06,ערוץ 7,"גורם בכיר בממשלה: לא טוב שהממשלה נשענת על רע""מ"
76,17:00 20/06,ישראל היום,בוקר עצוב בהרצליה: דולפינין נמצא מת בחוף הים
77,17:00 20/06,ice,"גלאון לוחצת על בנט: ""התפטר והעבר את התפקיד ללפיד"""
78,17:00 20/06,ice,נועה קירל לא בוחלת באמצעים: זה הצעד כנגד עדן חסון
79,17:00 20/06,ice,פיצוי של 150 אלף שקל: מי הזכאים לתבוע?
80,17:00 20/06,וואלה,משגיח בחינות תיאוריה מי-ם נעצר בחשד שביצע מעשים מגונים בנערות
81,16:58 20/06,ישראל היום,"העונה ה-18: שרן ייני האריך רשמית את חוזהו במכבי ת""א"
82,16:58 20/06,ישראל היום,בוקר עצוב בחוף הים: דולפינין נמצא מת בהרצליה
83,16:56 20/06,mako,"דובר צה""ל: מפקד פיקוד המרכז חתם על צו החרמה והריסה לביתו של המחבל צבחי אבו שקיר, ממבצעי הפיגוע באלעד"
84,16:53 20/06,ערוץ 7,"ראשי אגודת האיכרים הגיעו להודות לסיעת ש""ס על הפלת הצו שפוגע לטענתם בענף ההטלה"
85,16:52 20/06,ערוץ 7,ראשי אגודת האיכרים הגיעו להודות לסיעת ש״ס על הפלת הצו שפוגע לטענתם בענף ההטלה
86,16:50 20/06,ערוץ 7,נעצרו 5 חשודים באירועי שוד אלימים שאירעו בתל אביב בתקופה האחרונה
87,16:46 20/06,מעריב,הכנסת אישרה תקנות לאיסור לולי כלובים
88,16:45 20/06,ice,המחסור בעובדי היי-טק – הזדמנות לצמצום פערים חברתיים בישראל
89,16:45 20/06,ice,במאי זוכה אוסקר נעצר על תקיפה מינית באיטליה
90,16:45 20/06,ice,בעלי אפריקה ישראל מלונות זכה לביקור של אורח מיוחד
91,16:45 20/06,ice,"טבע נגד הוועד: ""טובת העובדים לא עומדת לנגד עיניהם"""
92,16:45 20/06,ice,זוכה פרס נובל מוכר את המדליה למען הילדים באוקראינה
93,16:44 20/06,ערוץ 7,"ח""כ אבי מעוז: ""העולם מתחיל להתפכח מהטרלול הפוסט מודרני"""
94,16:35 20/06,mako,לפיד רומז שיתנגד להורדת אחוז החסימה: אני מאבותיו של העלאת אחוז החסימה אבל אקשיב לחבריי ונקבל החלטה
95,16:34 20/06,ערוץ 7,"ח""כ משה ארבל ביקר בבית נצח יהודה: ""מרשים ומרגש"""
96,16:34 20/06,וואלה,קנדה: חוק האוסר על ייצור ויבוא כלי פלסטיק חד פעמיים ייכנס לתוקף בדצמבר
97,16:32 20/06,Ynet,"לפיד על ההצעות לאורבך: ""עברייניות, נוודא שייחקרו"". נתניהו: ""השלם את המלאכה"""
98,16:32 20/06,ערוץ 7,אושרו התוכניות לבניית שכונת הענק החדשה של תל אביב
99,16:30 20/06,ice,בהשקעה של חצי מיליון שקל: נופי ישראל בפרסומת חדשה
100,16:30 20/06,ice,אייל גולן גזר קופון: כמה קיבל מהמכירות במזנון בהופעה?
101,16:30 20/06,ice,נועה קירל נוקמת בעדן חסון: זו הופעת הענק שמתוכננת
102,16:29 20/06,ישראל היום,חברת הדברה נקנסה לאחר שהשאירה חומר מסוכן בקופסת מטרנה בגן ילדים
103,16:28 20/06,Ynet,"הנדל על ממשלה עם נתניהו: ""טעות עושים פעם אחת""; קיש: ההיסטוריה לא תזכור שהצבענו נגד תקנות יו""ש"
104,16:23 20/06,מעריב,"דובר צה""ל: נחתם צו הריסה לבית אחד המחבלים שביצעו את הפיגוע באלעד"
105,16:22 20/06,ערוץ 7,ערבי תושב לוד חנק את אחותו למוות וקבר את הגופה בבאר
106,16:20 20/06,ישראל היום,מסתמן: חיסון נגד כלבת יחול פעם בשנתיים
107,16:15 20/06,ישראל היום,חוק הסיוע לעצמאים שנפגעו מהאומיקרון לא יעלה להצבעה
108,16:15 20/06,ice,גיא לרר חשף: התשובה המבישה של בעלי הפורום לעיתונאי הצינור
109,16:15 20/06,ice,"בכירי הנדל""ן התכנסו, זו הזווית שלהם לגבי מחירי הדיור"
110,16:07 20/06,mako,"בעלי הפורום לשעבר, יוסי שוורץ, יעמוד לדין בגין אונס ועבירות מין נוספות בשתי מתלוננות"
111,16:07 20/06,mako,"גופת גבר אותרה במצב ריקבון מתקדם - אשתו, כבדת ראייה שמרותקת למיטה, נמצאה לידו"
112,16:07 20/06,ערוץ 7,עולם השידוכים סוער: האם לשלוח תמונה?
113,16:06 20/06,וואלה,"גופת גבר נכה בן 56 אותרה בדירתו בפ""ת; אישתו הסיעודית אותרה לידו"
114,16:05 20/06,ערוץ 7,הפלסטינים דורשים קליטת 6.4 מיליון פליטים פלסטינים בישראל
115,16:02 20/06,ישראל היום,"נשאר בנגב: רותם חטואל האריך חוזהו בהפועל ב""ש בשלוש עונות"
116,16:02 20/06,ערוץ 7,"תומר גינת החליט לחתום בהפועל ת""א"
117,16:02 20/06,ערוץ 7,גבעת אוהביה | סיבת הפינוי: חריש ערבי בשטח הגבעה
118,16:00 20/06,ice,אלה החברות שמתמזגות ומקלות עליכם בהזמנת חופשה
119,15:59 20/06,ישראל היום,"איתמר ניצן נפרד מבית""ר ירושלים: ""שמח אם הצלחתי לתת השראה"""
120,15:54 20/06,mako,"צה""ל והמשטרה סיכלו הברחת סמים בגבול לבנון בשווי של כמיליון שקלים"
121,15:52 20/06,ערוץ 7,צו הריסה לבית אחד מהמחבלים שביצעו את הפיגוע באלעד
122,15:50 20/06,וואלה,בלגיה: 70 אלף עובדים יצאו לרחובות במחאה על יוקר המחיה
123,15:49 20/06,mako,"אישום נגד שמואל ברהמי, בן 55 מאשדוד, בהיותו תחת צו פיקוח על עברייני מין - ביצע מעשים מגונים בנשים"
124,15:46 20/06,Ynet,אישום נגד בעלי מועדון הפורום הפורש: אנס מבלה וביצע מעשה מגונה באחרת
125,15:45 20/06,ישראל היום,"במשרד הבריאות מודאגים: זינוק בתחלואה בקרב החוזרים מחו""ל"
126,15:42 20/06,ישראל היום,"חוזר הביתה: תומר גינת בחר לחתום בהפועל ת""א"
127,15:42 20/06,ישראל היום,"""נכון שאת רוצה את זה?"": הבעלים של מועדון הפורום מואשם בעבירות של אינוס"
128,15:39 20/06,ערוץ 7,תושב אבו סנאן יואשם בגין מעשים מגונים בקטינים עולים מאוקראינה
129,15:34 20/06,mako,"בעלי הפורום לשעבר, יוסי שוורץ, יעמוד לדין בגין אונס ועבירות מין נוספות בשתי מתלוננות"
130,15:32 20/06,Ynet,"לפיד על ההצעות לאורבך: ""עברייניות, נוודא שייחקר"". נתניהו: ""השלם את המלאכה"""
131,15:30 20/06,ישראל היום,וואטסאפ מפתיעה: ניתן להשתיק אדם ספציפי בקבוצה
132,15:30 20/06,מעריב,"כתב אישום הוגש כנגד בעלי מועדון ""הפורום"" בגין ביצוע עבירות מין בשתי מתלוננות"
133,15:30 20/06,israeldefense,"פרשנות | ישראל מנסה למכור , שוב, מערכות הגנה אווירית לאמירויות - הפעם תחת המותג Middle East Air Defense"
134,15:27 20/06,ישראל היום,הבעלים של מועדון הפורום מואשם בעבירות של אינוס
135,15:27 20/06,ערוץ 7,גבול לבנון: סוכלה הברחת סמים בשווי של כמיליון שקל
136,15:23 20/06,ערוץ 7,"כתב אישום הוגש נגד בעלי מועדון הפורום, יוסי שוורץ בגין עבירות מין"
137,15:23 20/06,ערוץ 7,נתניהו בסיעת הליכוד: כרגע אנחנו הולכים על פיזור הכנסת אלא אם נקבל מודיעין שיש בעיה
138,15:16 20/06,וואלה,ברזיל: נמצאה סירת המנוע של העיתונאי הבריטי ומומחה השבטים
139,15:15 20/06,ice,"משתתפת האח הגדול תיפרד ממותג האופנה? ""לא לוקחים אחריות"""
140,15:15 20/06,ערוץ 7,"נתניהו לאורבך: ""אסור לך להיות חלק מהביזיון והבושה, תסיים את המלאכה"""
141,15:13 20/06,ערוץ 7,"נתניהו לאורבך: ""אסור לך להיות חלק מהביזיון והבושה"""
142,15:11 20/06,וואלה,אמסטרדם: שביתה ספונטנית של צוותי הניקיון בנמל התעופה סכיפול
143,15:10 20/06,ערוץ 7,"נתניהו: ""עליות המחירים באשמת בנט, לפיד ועבאס"""
144,15:09 20/06,ישראל היום,באמצע יום לימודים: רכב עלה באש במרכז הבינתחומי
145,15:09 20/06,ישראל היום,"רודיגר הוצג בריאל מדריד: ""אני יודע שאני לוקח צעד גדול"""
146,15:07 20/06,mako,בצל המאבק בקורונה: קוריאה הצפונית סובלת ממגפה חדשה
147,15:06 20/06,ישראל היום,חיים נתן מתכנן פיננסי: כך תנצלו את המשבר הכלכלי
148,15:06 20/06,ישראל היום,מגמה חיובית: זמני הטיפול בתלונות ציבוריות התקצרו
149,15:06 20/06,ישראל היום,זה הסכום ששילמה משטרת ישראל על תביעות נזיקין ודרישות פיצוי שהוגשו נגדה
150,15:05 20/06,ערוץ 7,ניו יורק טיימס: הקליע שהרג את שירין אבו עאקלה הגיע מרכב צבאי ישראלי
151,15:04 20/06,מעריב,הוועדה לקידום מעמד האישה אישרה לדחות את התיקון לחוק למניעת אלימות במשפחה
152,15:03 20/06,ישראל היום,על חשבון סעודיה: רוסיה הפכה לספקית הנפט הגדולה ביותר של סין
153,15:03 20/06,ישראל היום,"לפיד במסר למורדים: ""מי שלא עומד במתח, שיתפטר"""
154,15:00 20/06,ישראל היום,"האם עירוני ר""ג תשחק בעונה הבאה בליגת העל?"
155,15:00 20/06,ישראל היום,תקיפה בסוריה: 15 חיילים בצבא אסד נהרגו במארב
156,15:00 20/06,ישראל היום,"""העשור הכי טוב שהיה פה"": בחזרה לשנות ה-90 בתיאטרון תמונע"
157,15:00 20/06,ice,הכאוס בתעופה: זו החברה שתבטל אלפי טיסות בקיץ הקרוב
158,15:00 20/06,ice,"סכסוך עבודה בטבע: זו הסיבה ש-1,200 עובדים ישבתו"
159,14:57 20/06,וואלה,יוון תציע למשקי בית סובסידיות להחלפת מקררים ומזגנים ישנים
160,14:55 20/06,ערוץ 7,השר לפיד מודה בשיתוף פעולה עם הרשימה המשותפת
161,14:55 20/06,Ynet,"לפיד על השריון המסתמן לאורבך בליכוד: ""הצעות עברייניות, נוודא שייחקר"""
162,14:52 20/06,ערוץ 7,השר יאיר לפיד מודה בשיתוף פעולה עם הרשימה המשותפת
163,14:49 20/06,מעריב,תושבת יבנה נעצרה בחשד לתקיפה ושוד קשיש בלוד
164,14:45 20/06,ישראל היום,"לפיד בישיבת הסיעה: ""הממשלה מגנה מפני שלטון השנאה"""
165,14:45 20/06,ice,"רותם כהן חושף: ""אני עם הפרעות קשב קיצוניות"""
166,14:45 20/06,ice,"נטלי דדון ושי מיקה פותחות חזית: ""גזל"", ""הורסת פרנסה"""
167,14:45 20/06,ice,ליונל מסי הגשים חלום למעריץ - בעזרת פיתוח ישראלי
168,14:45 20/06,ice,בעלות מאות אלפים: לימוד אנגלית כבר בגיל הרך
169,14:44 20/06,ערוץ 7,לוד: נעצרה חשודה שתקפה קשיש ושדדה את תיקו
170,14:40 20/06,ישראל היום,העיצומים במשרד החוץ צפויים לפגוע באלפי סטודנטים זרים לישראל
171,14:40 20/06,ערוץ 7,לפיד: יש לנו תפקיד היסטורי מול הקיצוניות - מי שקשה לו שילך הביתה
172,14:39 20/06,Ynet,"ליברמן ליפה בן דויד: ""מספיק עם השביתות. מציע מו""מ בלי אולטימטומים"""
173,14:39 20/06,Ynet,"גנץ: ""מערך ההגנה האווירית האזורי סיכל ניסיונות איראניים לפגוע בישראל ובמדינות אחרות"""
174,14:37 20/06,ישראל היום,יהל מלמד צפוי להצטרף להפועל גליל עליון
175,14:34 20/06,מעריב,"מטריקס תרכוש את חברת רדט ציוד ומערכות בע""מ"
176,14:34 20/06,ישראל היום,"הניו יורק טיימס: ""כוח מיוחד של צה""ל אחראי לירי בשירין אבו-עאקלה"""
177,14:34 20/06,ישראל היום,הלקוחות זועמות: האם הדיירת דיאן שוורץ תיפרד מעדיקה?
178,14:32 20/06,וואלה,"ליברמן: ""אין מקום לכל הניסיונות לתדלק את מחאת הדיור"""
179,14:32 20/06,Ynet,"גנץ: ""מערך ההגנה האווירית האזורי נגד איראן סיכל ניסיונות לפגוע בישראל ובמדינות אחרות"""
180,14:32 20/06,רוטר.נט,ליברמן: קורא ליפה בן דוד תפסיקו עם השביתות| נקיים מו'מ רק בשבוע הבא| המחירים כאן עלו אבל לא בהרבה
181,14:30 20/06,ice,נעליים חדשות? זה מותג היוקרה האמריקאי שיגיע לישראל
182,14:30 20/06,ice,נועה קירל מחקה את התמונות באינסטגרם - ואז זה קרה
183,14:30 20/06,ערוץ 7,דני דנון: ממשלה שלא מסוגלת להיאבק בטרור - אין לה זכות קיום
184,14:29 20/06,מעריב,"ילד בן 4 נמשה מבריכה בפרדס חנה כרכור כשהוא מעורפל הכרה, מצבו בינוני"
185,14:25 20/06,ישראל היום,"חה""כ ניר אורבך החליט שלא לתמוך בפיזור הכנסת השבוע | זהו התסריט שבו החוק יעבור בלעדיו"
186,14:24 20/06,ערוץ 7,"בן גביר לחרדים: ירי בנגמ""ש – טעות חמורה"
187,14:24 20/06,ערוץ 7,"ילד בן 4 טבע בבריכה בפרדס חנה, מצבו בינוני"
188,14:18 20/06,מעריב,"נשיא ארה""ב הודיע כי יטוס לערב הסעודית, אך לא יפגש עם יורש העצר"
189,14:17 20/06,ערוץ 7,"ליברמן: ""אין מקום לניסיונות לתדלק את מחאת הדיור"""
190,14:17 20/06,Ynet,"ליברמן ליפה בן דויד: ""מספיק עם השביתות. מציע מו""מ מיום ראשון, בלי אולטימטומים"""
191,14:15 20/06,ice,"היהלומנים הישראלים מדווחים על תנועה חזקה: ""הצלחה גדולה"""
192,14:15 20/06,ice,משדר תרומות לארגון שלוה: זה הסכום שגוייס
193,14:15 20/06,ice,לאחר תחקיר הצינור: בעלי הפורום הואשם בעבירות מין
194,14:15 20/06,ice,חומר רעיל בפינת המשחקים: קנס לחברת ההדברה שסיכנו ילדים
195,14:13 20/06,mako,גורמים בכנסת מספרים שאורבך לא יתמוך השבוע בפיזור הכנסת
196,14:13 20/06,ישראל היום,"מקרה אלימות חמור ביו""ש: גבר וכלבו תקפו ילד במגרש משחקים"
