,Time,Source,Content
398,10:00 20/06,mako,"לאחר ביקור השר לבט""פ בבאקה אל-גרבייה - בוצע ירי לעבר עסק בעיר"
399,10:00 20/06,ice,עוקץ חדש בכביש: זו השיטה שיש להיזהר ממנה
400,09:59 20/06,mako,"שנות מאסר נגזרו על נור א-דין שינאוי, שבשנת 2018 דקר בעפולה את שובה מלכה ופצע אותה באורח קשה"
401,09:59 20/06,mako,"המשטרה מבקשת את עזרת הציבור באיתור הנעדר אליה מסלוט, בן 47 מבאר שבע, שנראה לאחרונה אתמול בעיר"
402,09:58 20/06,ישראל היום,עֶשְׂרִים בְּחֹדֶשׁ יוּנִי
403,09:57 20/06,Ynet,23 שנות מאסר למחבל שדקר נערה בדרך לבחינת בגרות
404,09:53 20/06,ישראל היום,לא יולי־אוגוסט - אב־אלול
405,09:52 20/06,מעריב,"שלושה תושבי הפזורה הבדואית נעצרו בחשד להברחת אמל""ח מגבול ירדן לישראל"
406,09:49 20/06,ערוץ 7,סוכלה הלילה הברחת אמצעי לחימה מגבול ירדן
407,09:45 20/06,ice,מחסור חמור בסופרמרקטים: זה המשבר שמסכן את התינוקות
408,09:45 20/06,ice,רייטינג: האח הגדול שוב הצליחה לנצח את מאסטר שף?
409,09:44 20/06,מעריב,"קורונה בישראל: 10,202 מאומתים אובחנו ביממה האחרונה"
410,09:40 20/06,Ynet,המתנחלים ניצחו באביתר. ככה קמים יישובים
411,09:40 20/06,Ynet,משטרת זהו בינתיים
412,09:39 20/06,ערוץ 7,השמאל הקיצוני יפגין מול ביתו של אלוף פיקוד מרכז
413,09:37 20/06,וואלה,"כ-10,200 בני אדם אובחנו חיוביים לקורונה ביממה האחרונה"
414,09:36 20/06,ישראל היום,"""הנשים שלו"": דניאל גרינברג מדברת על ההופעה של איל גולן"
415,09:36 20/06,ישראל היום,משבר מדעי הרוח: תהליך ישראלי הרסני
416,09:36 20/06,ישראל היום,השתלת שיער בטורקיה – הכירו את חברת FOREVER YOUNG שעובדת עם טובי הרופאים בעולם
417,09:35 20/06,וואלה,"כ-10,200 מאומתים חדשים לקורונה ביממה האחרונה"
418,09:34 20/06,מעריב,כוחות הביטחון עצרו הלילה 13 מבוקשים והחרימו אמצעי לחימה ברחבי יהודה ושומרון
419,09:33 20/06,ישראל היום,"הונאת הענק: חמישה חשודים נעצרו לאחר שהבטיחו את ""השקעת החלומות"" ועקצו כ-120 מיליון שקל"
420,09:32 20/06,וואלה,13 מבוקשים נעצרו על ידי כוחות הביטחון ברחבי יהודה ושומרון
421,09:31 20/06,מעריב,נשיא אוקראינה זלנסקי ינאם בפני האוניברסיטה העברית השבוע
422,09:31 20/06,ערוץ 7,"כוחות הביטחון עצרו הלילה 13 מבוקשים ביו""ש"
423,09:30 20/06,ישראל היום,כבר לא צריך לנסוע לצפון בשביל הקרואסון הטוב בישראל
424,09:29 20/06,מעריב,חברת הלואו-קוסט EasyJet הודיעה על ביטול של חלק מהטיסות בחודשי הקיץ
425,09:26 20/06,וואלה,5 נעצרו בחשד שהונו משקיעים בסוך של כ-120 מיליון שקלים
426,09:24 20/06,ישראל היום,חובה להכיר: מילון דור ה־Z
427,09:24 20/06,ישראל היום,זלנסקי מזהיר: רוסיה נערכת למתקפה גדולה נוספת
428,09:18 20/06,ישראל היום,"""באתי מאותו אולם של לינוי, אבל אני זו אני"""
429,09:15 20/06,ישראל היום,הונאת הענק: חמישה חשודים נעצרו לאחר שהבטיחו את השקעת החלומות ועקצו כ-120 מיליון שקל
430,09:15 20/06,ישראל היום,"""טענו בעבר שאי אפשר בעברית"": חוגגים היפ־הופ ישראלי"
431,09:15 20/06,ערוץ 7,"גורם בקואליציה: שקד, אורבך ובנט - מתואמים על מלא"
432,09:15 20/06,ice,סצנת הראפ הישראלית מתאחדת על במה אחת: איפה זה יקרה וכמה יעלה כרטיס?
433,09:15 20/06,ice,זהירות! מתברר שהשליחים טועמים מהאוכל שהזמנתם
434,09:15 20/06,ice,"גוגל מטרילה: ""אם רק היה לאפל צוות מהנדסים מוכשר"""
435,09:11 20/06,ערוץ 7,צבי האוזר: הממשלה טובה לימין
436,09:05 20/06,ערוץ 7,"חמישה נעצרו בחשד שהונו משקיעים בארץ ובחו""ל בהיקף של 120 מיליון שקלים"
437,09:05 20/06,Ynet,בתקווה לגיבוש רוב: בליכוד יניחו השבוע הצעה לפיזור הכנסת
438,09:05 20/06,Ynet,"חשד: הבטיחו למשקיעים ""טכנולוגיות משנות עולם"" - והונו אותם ב-120 מיליון שקל"
439,09:00 20/06,ישראל היום,"אזהרה לעיתונאי הארגנטינאי: ""חיזבאללה עלול להתנקש בך"""
440,09:00 20/06,מעריב,חמישה חשודים נעצרו בחשד למעורבות בפרשייה שבמרכזה מיזם הונאה בינלאומי
441,09:00 20/06,ice,זהירות! מסתבר שהשליחים טועמים מהאוכל שהזמנתם
442,08:57 20/06,ישראל היום,"אזהרה לעיתונאי הארגנטינאי: ""חיזבאללה עשוי להתנקש בך"""
443,08:55 20/06,ישראל היום,חוזר לירוק: ניקיטה רוקאביצה סיכם במכבי חיפה
444,08:55 20/06,וואלה,גבר כבן 30 נפצע בינוני בתאונת דרכים בבאר יעקב
445,08:53 20/06,מעריב,"שני חשודים נעצרו כשניסו לחצות מרצועת עזה לישראל, ברשותם נתפסה סכין"
446,08:52 20/06,ישראל היום,"חלש, סתמי ורחוק מהסטנדרט של פיקסאר: ""שנות אור"" מאכזב"
447,08:51 20/06,Ynet,"פני מחאת מחירי השכירות: ""אנשים מכל הארץ, עם מגוון דעות - זו מצוקה של כולם"""
448,08:48 20/06,מעריב,גבר כבן 30 נפצע באורח בינוני בתאונת דרכים בבאר יעקב
449,08:47 20/06,ערוץ 7,"לוחמי צה""ל עצרו במהלך הלילה שני חשודים שניסו לחצות את גבול עזה"
450,08:45 20/06,ice,חשש למתקפת סייבר: מי הפעיל את האזעקות בירושלים ובאילת?
451,08:45 20/06,ice,חוגגים את השקת עונת הרחצה בצורה מקורית במיוחד
452,08:44 20/06,ערוץ 7,פצוע בינוני בתאונה ברחוב הרב משה שמואל שפירא בבאר יעקב
453,08:43 20/06,מעריב,"יו""ר ארגון ההורים: ""תומכים במורים, אבל הם עושים ניצול ציני כשמשביתים ביום קבלת התעודות"""
454,08:43 20/06,ישראל היום,"צה""ל הקפיא את הריסת בתי המחבלים בפיגוע באריאל"
455,08:43 20/06,ישראל היום,"בהפועל ב""ש עוקבים אחר מצבו הבריאותי של מאור מליקסון"
456,08:38 20/06,מעריב,"שאשא-ביטון: ""אין לנו מורים וגננות לפתוח את השנה, לדבר על החופשים זה לדבר על קצפת"""
457,08:36 20/06,ערוץ 7,"מנכ""ל איגוד האינטרנט הישראלי: המתקפה לא פגעה בתשתית ""קריטית"""
458,08:34 20/06,Ynet,שביתת נהגי האוטובוסים נמשכה הבוקר - באופן חלקי: צווי מניעה לאחד הארגונים
459,08:34 20/06,Ynet,"הצייד, העריק והמשוריין. הכנסת היא סידור עבודה"
460,08:30 20/06,ice,הלחם ייעלם מהמדפים: זה המוצר שיעלה לכם הרבה יותר
461,08:30 20/06,israeldefense,איחוד האמירויות מביעה חשש פומבי מהגרעין האיראני 
462,08:27 20/06,Ynet,"חרדים צעירים ומודרנים הולכים שבי אחרי בן גביר. בש""ס וביהדות התורה מודאגים"
463,08:23 20/06,ישראל היום,"""בשבילי תמיר בלאט היה ה-MVP"""
464,08:22 20/06,ערוץ 7,עניין אישי והפעם עם דני פחימה
465,08:19 20/06,ערוץ 7,צומת לב המפרץ בחיפה נחסם בעקבות שביתת נהגי האוטובוסים
466,08:15 20/06,israeldefense,אל ג'זירה השיגה צילום של הקליע שהרג את העיתונאית שירין אבו עאקלה
467,08:12 20/06,מעריב,פתח תקווה: גבר נמצא ללא רוח חיים בדירה בעיר
468,08:11 20/06,ישראל היום,למה להלחיץ סתם? הטרחנות של כאן חדשות
469,08:08 20/06,ערוץ 7,מערכת הביטחון עצרה את הריסת בית המחבל מהפיגוע באריאל
470,08:04 20/06,mako,לקראת פסגת האיחוד האירופי: זלנסקי צופה שתקיפות רוסיה יתגברו
471,08:01 20/06,ערוץ 7,ראשון לציון: נחשפה מעבדת הידרו ובה חומר החשוד כסם
472,08:01 20/06,Ynet,הדרג המדיני עצר את הריסת בית המחבל מאריאל
473,08:00 20/06,israeldefense,״מכינים משרדים״ - זו תגובת המדינה לעתירה מדוע וועדת החקירה לעניין רכש הצוללות טרם התחילה בעבודתה
474,08:00 20/06,israeldefense,מערך הסייבר חושד כי הפעלת האזעקות בירושלים ואילת - מתקפת סייבר
475,08:00 20/06,ice,המתחרה של וואטסאפ משיקה צעד שישנה לכם את החיים
476,08:00 20/06,ice,הפכה למיליונרית בדרך הכי לא צפויה - בגיל 11
477,07:57 20/06,ערוץ 7,הלחץ על אורבך: באופוזיציה יעלו השבוע את החוק לפיזור הכנסת
478,07:56 20/06,Ynet,בעקבות גל הפרישות: הכשרת השוטרים תקוצר מ-7 חודשים ל-7 שבועות
479,07:55 20/06,ערוץ 7,"הרב הראשי למפכ""ל המשטרה: בדוק את חילול השבת בחומש"
480,07:53 20/06,ישראל היום,בן זיני עצבני: פורק הכל על התקרית בלונדון
481,07:52 20/06,Ynet,שביתת נהגי האוטובוסים נמשכת הבוקר - באופן חלקי: צווי מניעה לאחד הארגונים
482,07:51 20/06,מעריב,ראשון לציון: תושב העיר בשנות ה-20 לחייו נעצר בחשד לניהול מעבדת הידרו לייצור סמים
483,07:50 20/06,ישראל היום,"על פרשת דרכים: גורלה של בית""ר ירושלים על הכף"
484,07:50 20/06,ערוץ 7,אלקין: הציעו לכולנו כל תפקיד שקיים - אנחנו עומדים כדבוקה אחת
485,07:47 20/06,ישראל היום,חסימות בערים מרכזיות בעקבות מחאת הנהגים
486,07:47 20/06,ישראל היום,חשד: בעקבות מתקפת סייבר אזעקות הופעלו בירושלים ובאילת
487,07:47 20/06,mako,בליכוד יבקשו היום להעלות את ההצעה לפיזור הכנסת על סדר יומה של המליאה
488,07:43 20/06,מעריב,כתב אישום הוגש נגד תושב הנגב שפגע בניידת משטרה עם רכבו בבאר שבע
489,07:42 20/06,ישראל היום,בעקבות בקשת מערך הסייבר: אזעקות הופעלו בירושלים ובאילת
490,07:41 20/06,Ynet,חשד: מתקפת סייבר של האקרים איראנים הובילה לאזעקות שווא בירושלים ובאילת
491,07:40 20/06,ערוץ 7,"הקואליציה תתמוך בשני חוקים שייצרו עימות מול רע""ם"
492,07:37 20/06,mako,חשד: התקלה במערכות הכריזה באילת וירושלים אתמול נגרמה בשל מתקפת סייבר
493,07:36 20/06,ישראל היום,"הילדים שלנו נהדרים, תנו להם את הבמה בליגה"
494,07:33 20/06,ערוץ 7,טרנד חדש? האמנים הימנים כבר לא מפחדים להביע את דעתם
495,07:31 20/06,ערוץ 7,סגן שר החוץ הפולני: לא דרשנו וטו על תכנים במשלחות הנוער מישראל
496,07:30 20/06,israeldefense,דיווח: מכרז המל״טים של רומניה בוטל  
497,07:30 20/06,Ynet,חשד: תקיפת סייבר הובילה לאזעקות שווא בירושלים ובאילת
498,07:27 20/06,וואלה,חשד: תקיפת סייבר הובילה לאזעקות שווא בירושלים ואילת
499,07:21 20/06,Ynet,"סגן שר החוץ הפולני: ""לא דרשנו להטיל וטו על תכנים במשלחות הנוער מישראל"""
500,07:16 20/06,mako,עמותת אוהדי בית״ר ירושלים נפגשה אמש עם הבעלים משה חוגג שמעוניין למכור את הקבוצה
501,07:16 20/06,Ynet,בזמן שהמורים שובתים: שנת הלימודים בחטיבות הביניים ובתיכונים תסתיים היום
502,07:15 20/06,mako,אתיופיה: לפחות 230 מבני האמהרה נרצחו במחוז אורומיה בהתקפה רצחנית המיוחסת למורדים מקבוצת האורומו
503,07:15 20/06,ice,"פסגות: הפד גנב את הפוקוס לבנקים, והסתיר מגמה מדאיגה"
504,07:15 20/06,ice,קריסת הקריפטו כמעט ולא תשפיע על הכלכלה וזו הסיבה
505,07:14 20/06,mako,"איראן העבירה לארה""ב מסרים כי ויתרה על הדרישה להסיר את משמרות המהפכה מרשימת ארגוני הטרור הזרים"
506,07:12 20/06,ישראל היום,היסטוריה בקולומביה: לוחם גרילה לשעבר יהפוך לנשיא
507,07:12 20/06,ערוץ 7,חשד: הסיבה לאזעקות בירושלים ובאילת - תקיפת סייבר
508,07:11 20/06,mako,התחזית: שמים בהירים וטמפרטורות רגילות לעונה
509,07:06 20/06,ישראל היום,לב אמיץ: העונה של פאבלו לאסו
510,07:02 20/06,ערוץ 7,בן גביר בלם קמפיין חריף נגד דרעי
511,07:01 20/06,ישראל היום,שבוע של הכרעות בכנסת: כל התרחישים והדילמות שעל הפרק
512,07:00 20/06,מעריב,"ארה""ב: 37 בני אדם מתו ביממה האחרונה לאחר שנדבקו בנגיף הקורונה"
513,06:54 20/06,ערוץ 7,גם היום: הלימודים בכל מוסדות החינוך יחלו בשעה 10:00
514,06:47 20/06,Ynet,5 שנות מוחמד בן סלמאן: כך הפך MBS למנהיג החשוב במזרח התיכון
515,06:45 20/06,ערוץ 7,חברי הוועדה החוקרת את מהומות הקפיטול: שוקלים לזמן את פנס לעדות
516,06:44 20/06,ערוץ 7,הערכה במשרד הבריאות: העלייה בתחלואת הקורונה תימשך
517,06:29 20/06,ערוץ 7,"ארה""ב: נער בן 15 נהרג בתקרית ירי במופע מוזיקלי בוושינגטון הבירה"
518,06:23 20/06,וואלה,הלימודים יחלו הבוקר בשעה 10:00
519,06:23 20/06,ערוץ 7,"ארה""ב: נער בן 15 נהרג בתקרית ירי במופע מוזיקלי"
520,06:14 20/06,ערוץ 7,בלינקן בירך את נשיא קולומביה הנבחר
521,06:03 20/06,ערוץ 7,רוסיה מקדמת הצעת גינוי לישראל במועצת הביטחון
522,05:06 20/06,mako,בפעם החמישית: שביתה בתחבורה הציבורית – אלו הערים שיושפעו
523,05:03 20/06,וואלה,רעידת אדמה בעוצמה 5 הורגשה ביפן
524,04:59 20/06,ערוץ 7,תנועת האוטובוסים תושבת במספר אזורים בין 5:00 ל-8:30
525,04:36 20/06,וואלה,"ארה""ב: מברכים את גוסטבו פטרו על זכייתו בנשיאות קולמביה"
526,04:32 20/06,ערוץ 7,"שר האוצר הצרפתי: הלם דמוקרטי, אבל אנחנו עדיין יכולים למשול"
527,04:03 20/06,ערוץ 7,דיווח: באופוזיציה החליטו לשים את החוק לפיזור הכנסת על סדר היום השבוע
528,03:37 20/06,וואלה,המערב חייב להתוכנן למלחמה ארוכה באוקראינה
529,03:31 20/06,ערוץ 7,מצרים: מטוס קרב התרסק בעת אימון
530,03:04 20/06,ערוץ 7,ברזיל: המשטרה זיהתה חמישה חשודים נוספים ברצח העיתונאי הבריטי
531,02:45 20/06,ישראל היום,שני: הצעות מפתיעות
532,02:30 20/06,ערוץ 7,זלנסקי: רוסיה צפויה להגביר את התקיפות
533,02:28 20/06,וואלה,ברזיל: זיהינו 5 חשודים נוספים בפרשת רצח העיתונאי ומומחה השבטים
534,02:02 20/06,ערוץ 7,צפון קוריאה: כ-19 אלף בני אדם עם תסמיני קורונה אובחנו ביממה האחרונה
535,02:01 20/06,מעריב,"שר הנפט הלובי: תפוקת הנפט של לוב עלתה לכ-700,000 חביות ליום"
536,01:34 20/06,ערוץ 7,קולומביה: מועמד השמאל ניצח בבחירות לנשיאות
537,01:14 20/06,מעריב,ניצחון לשמאל בקולומביה: גוסטבו פטרו נבחר לנשיא
538,01:01 20/06,ערוץ 7,"סקר של הרשימה המשותפת: רע""ם לא עוברת את אחוז החסימה"
539,00:32 20/06,ערוץ 7,"ח""כ רוטמן: ישראל הייתה לפני נתניהו ותהיה גם אחריו"
540,00:29 20/06,וואלה,עימותים אלימים בין אזרחים ישראלים לפלסטינים בחברון
541,00:27 20/06,ישראל היום,"""2.2 מיליון יהפכו לנזקקים למזון"": האו""ם מזהיר מאסון הומניטרי בלבנון"
542,00:19 20/06,Ynet,עיצומי המורים נמשכים: גם הבוקר הלימודים בכל הארץ יחלו ב-10:00
543,00:19 20/06,Ynet,שביתת נהגי האוטובוסים תימשך הבוקר - באופן חלקי: צווי מניעה לאחד הארגונים
544,00:14 20/06,וואלה,הזרוע הצבאית של חמאס תסגור מחר את המרחב הימי ברצועת עזה
545,00:09 20/06,ערוץ 7,"מחאת אוהדי בית""ר י-ם החלה"
546,00:09 20/06,Ynet,שביתת נהגי האוטובוסים תימשך היום - באופן חלקי: צווי מניעה לאחד הארגונים
547,00:05 20/06,Ynet,"נעה זכתה בתחרות סיפורים של להב""ה - ותרמה את הכסף לנשים פלסטיניות"
548,23:58 19/06,מעריב,בליכוד החולט להגיש את הצעת החוק לפיזור הכנסת ביום רביעי
549,23:58 19/06,וואלה,זלנסקי: רוסיה עלולה להגביר את התקפותיה על אוקראינה
550,23:53 19/06,ערוץ 7,"הספרדים שוקלים פתיחת סמינרים: ""אין ברירה"""
551,23:46 19/06,ערוץ 7,"""כולם לכאן"": מחאת האוהלים חזרה לרוטשילד"
552,23:39 19/06,Ynet,"""הבנו שאף אחד לא יעשה כלום"": אחרי עשור, מחאת האוהלים חוזרת לרוטשילד"
553,23:37 19/06,mako,דובר צבא מצרים הודיע שמטוס קרב התרסק במדינה בעת אימון
554,23:34 19/06,Ynet,"20 ראשי רשויות נגד בחירות נוספות: ""השתגענו לגמרי? זה פשע"""
555,23:33 19/06,ערוץ 7,"כך התמודד בנצי גופשטיין עם ""נעה המטרילה"""
556,23:32 19/06,ערוץ 7,כאוס בשמיים: העומס הבלתי נסבל בנמלי התעופה באירופה
557,23:28 19/06,ישראל היום,"גורבנקו אחרי הישג השיא: ""שמחה שהשגתי את המטרה שלי"""
558,23:24 19/06,ערוץ 7,עיכובים בהמראות של טיסות Wizz מישראל
559,23:15 19/06,ice,חברת האבטחה של אייל גולן: המשתתפת תקפה את המאבטח
560,23:15 19/06,ice,"כוכב נבחרת ספרד נשדד ברחוב, אחיו נפצע בתקרית האלימה"
561,23:13 19/06,ישראל היום,"בשורה לנכי צה""ל: הסיוע הכספי יגדל"
562,23:10 19/06,mako,מפלה למקרון בבחירות לאספה הלאומית: מפלגת הימין הקיצוני של לה-פן מזנקת
563,23:10 19/06,Ynet,שביתת נהגי האוטובוסים תימשך מחר - באופן חלקי: צווי מניעה לאחד הארגונים
564,23:09 19/06,mako,"איציק סעידיאן בהופעה פומבית ראשונה: ""שמתי לי למטרה להשמיע את קולם של פצועי צה""ל"""
565,23:07 19/06,מעריב,רחובות: גבר בן 40 נפצע באורח בינוני בקטטה
566,23:03 19/06,ישראל היום,דיווח: איראן ויתרה על הדרישה להסיר את משמרות המהפכה מרשימת ארגוני הטרור
567,23:03 19/06,ישראל היום,שבוע של הכרעות בכנסת: כל התרחישים הדילמות שעל הפרק
568,23:03 19/06,ערוץ 7,גבר כבן 40 נפצע בינוני בקטטה ברחובות
569,23:00 19/06,ישראל היום,"על רקע הכוונה לאחד כיתות לימוד בשנה הבאה: ""מחאת הסרדינים"" חוזרת"
570,23:00 19/06,ישראל היום,למרות ההבטחות: הניתוח מציל החיים עדיין לא ניתן
571,23:00 19/06,ice,"ההורים נגד המורים: ""החלטה צינית ואכזרית, ניצול לא הוגן"""
572,23:00 19/06,ice,הנקניקים יורדים מהמדפים: אזהרה חמורה לצרכני הבשר
573,22:58 19/06,ערוץ 7,"ראש המועצה הדתית ברחובות ערך ביקורת פתע בשבת: ""מוזר להיכנס לקניון"""
574,22:56 19/06,וואלה,"איציק סעידיאן בהופעה פומבית ראשונה: ""מודה לקב""ה"""
575,22:56 19/06,ערוץ 7,"""שרלטן, חרפה"": קרב ציוצים בין לפיד לנתניהו"
576,22:54 19/06,ישראל היום,הבמאי-תסריטאי זוכה האוסקר פול האגיס נעצר לאחר שהואשם בתקיפה מינית
577,22:54 19/06,ישראל היום,לראשונה בישראל: טיפול הקרנה חדשני לחולי סרטן
578,22:51 19/06,ישראל היום,בלוז לחופש הגדול: תלמידי חטיבות הביניים והתיכונים מסיימים ללמוד
579,22:47 19/06,Ynet,"הלוחם שנפצע אנושות בשומר החומות השתחרר מבית החולים: ""המטרה - לנצח כל יום מחדש"""
580,22:46 19/06,ערוץ 7,"ח""כ אופיר סופר לאיציק סעידיאן שהופיע בפומבי לראשונה: ""טוב לראות אותך. עם ישראל מתפלל למענך"""
581,22:45 19/06,ice,דני אולמו נשדד ואחיו נפצע בתקרית אלימה ברחובות ולנסיה
582,22:44 19/06,ישראל היום,"""2.2 מיליון בני אדם יהפכו לנזקקים למזון"": האו""ם מזהיר מאסון הומניטרי בלבנון"
583,22:44 19/06,ערוץ 7,"משרד הביטחון נגד שוברים שתיקה: ""לא ראוי שמכינה תקיים פעילות עם ארגון המבקר את ישראל"""
584,22:41 19/06,ישראל היום,"""אתה המלאך שלי"": המפגש המרגש בין נכה צה""ל לתורם מח העצם שהציל את חייו"
585,22:39 19/06,ערוץ 7,מדגמים ראשוניים בצרפת: מקרון איבד את הרוב המוחלט בפרלמנט
586,22:38 19/06,ישראל היום,הטייס שנעצר בארגנטינה - דמות מפתח במשלוחי הנשק האיראניים
587,22:38 19/06,ישראל היום,"צפו: מאות אוהדי בית""ר הפגינו מול ביתו של אורן חסון"
588,22:35 19/06,ישראל היום,"""אסור לפלג את הגוש"": בן גביר בלם קמפיין חריף נגד דרעי"
589,22:35 19/06,ערוץ 7,"ניר אורבך, מי יודע אם לעת הזו הגעת למלכות - דעה"
590,22:32 19/06,mako,על פי המדגמים בצרפת: הנשיא מקרון צפוי לאבד את הרוב בפרלמנט
591,22:30 19/06,Ynet,למרות עשרות תלונות: הגינקולוגים החשודים בעבירות מין ממשיכים לעבוד כרופאים
592,22:30 19/06,Ynet,"מקרון איבד את הרוב המוחלט בפרלמנט, הישגים ללה פן ולמנהיג השמאל הקיצוני"
593,22:29 19/06,ישראל היום,המאמר שלא כדאי לקרוא
594,22:26 19/06,רוטר.נט,שוב נשמעות אזעקות בירושלים
595,22:25 19/06,Ynet,"איציק סעידיאן בהופעה פומבית ראשונה: ""המטרה שלי - להשמיע את קולם של פצועי צה""ל"""
596,22:25 19/06,ערוץ 7,"ניר אורבך, מי יודע אם לעת הזו הגעת למלכות"
597,22:19 19/06,ישראל היום,"אופיר חיים: ""אני חושב שיכולנו לשחק טוב יותר"""
598,22:18 19/06,מעריב,בעקבות מציאת חיידק מסוג ליסטריה מונוציטוגנס: חברת מעדני בשר השוקת מבצעת ריקול לנקניקים
599,22:18 19/06,ערוץ 7,סכנה אקולוגית: האיש שיצר צבא צפרדעים
600,22:15 19/06,ice,"שובר קופות חדש? זה הסכום שהכניס ""שנות אור"" בבכורה"
601,22:13 19/06,ערוץ 7,"השר אביגדור ליברמן: ייתכן שח""כ אורבך נמצא במצב של סחיטה באיומים"
